{
  "candidateId": "canon://Claim.claimDate",
  "entity": "Claim",
  "attribute": "claimDate",
  "dataType": "date",
  "cardinality": "1..1",
  "obligation": { "level": "mandatory" },
  "placement": "core",
  "placementRule": "present with mandatory obligation in all 3 regions",
  "namingSource": "acord",
  "rationale": "Aligned to ACORD Claim.lossDate; core because present in all three regions.",
  "clusterRefs": ["cluster://claim-date"],
  "weight": 5,
  "ratification": { "status": "pending", "sme": null, "decidedAt": null }
}
